{
  "schema_version": 1,
  "kind": "base",
  "priority": 200,
  "match": {
    "battle_type": "wild",
    "species": [
      "cobblemon:heatran",
      "cobblemon:cresselia",
      "cobblemon:darkrai",
      "cobblemon:phione",
      "cobblemon:manaphy",
      "cobblemon:shaymin"
    ]
  },
  "sound": "battlemusic:legendary.remaining_gen4",
  "transition_ticks": 4
}
