{
  "schema_version": 1,
  "kind": "base",
  "priority": 200,
  "match": {
    "battle_type": "wild",
    "species": [
      "cobblemon:ironleaves",
      "cobblemon:ironcrown",
      "cobblemon:ironboulder"
    ]
  },
  "sound": "battlemusic:legendary.paradox_future_trio",
  "transition_ticks": 4
}
