{
  "schema_version": 1,
  "kind": "base",
  "priority": 200,
  "match": {
    "battle_type": "wild",
    "species": [
      "cobblemon:walkingwake",
      "cobblemon:ragingbolt",
      "cobblemon:gougingfire"
    ]
  },
  "sound": "battlemusic:legendary.paradox_past_trio",
  "transition_ticks": 4
}
