{
  "schema_version": 1,
  "kind": "base",
  "priority": 200,
  "match": {
    "battle_type": "wild",
    "species": [
      "cobblemon:regirock",
      "cobblemon:regice",
      "cobblemon:registeel",
      "cobblemon:regigigas",
      "cobblemon:regieleki",
      "cobblemon:regidrago"
    ]
  },
  "sound": "battlemusic:legendary.regi",
  "transition_ticks": 4
}
