{
  "schema_version": 1,
  "kind": "base",
  "priority": 200,
  "match": {
    "battle_type": "wild",
    "species": [
      "cobblemon:cosmog",
      "cobblemon:cosmoem",
      "cobblemon:lunala",
      "cobblemon:solgaleo"
    ]
  },
  "sound": "battlemusic:legendary.cosmog_family",
  "transition_ticks": 4
}
