{
  "schema_version": 1,
  "kind": "base",
  "priority": 200,
  "match": {
    "battle_type": "wild",
    "species": [
      "cobblemon:wochien",
      "cobblemon:chienpao",
      "cobblemon:tinglu",
      "cobblemon:chiyu"
    ]
  },
  "sound": "battlemusic:legendary.treasures_of_ruin",
  "transition_ticks": 4
}
